,raw,char,line
18,ANNE: How can I get back?,ANNE,How can I get back?
19,JACK: It’s a cesspool; not many civilians make it this far.,JACK,It’s a cesspool; not many civilians make it this far.
20,"ANNE: I’ve been tracking my husband for months.  If he’s there, I’ve missed my only chance to get off the train.",ANNE,"I’ve been tracking my husband for months.  If he’s there, I’ve missed my only chance to get off the train."
21,JACK:  Life is full of missed opportunities.,JACK, Life is full of missed opportunities.
22,ANNE: What are you doing here?,ANNE,What are you doing here?
23,"JACK: I’ve been working as a war correspondent, back and forth between London and Belgium for a year.",JACK,"I’ve been working as a war correspondent, back and forth between London and Belgium for a year."
24,ANNE: Putting the name Jack Garrison to good use?,ANNE,Putting the name Jack Garrison to good use?
25,JACK: It hasn’t hurt.  American papers love the sensational.,JACK,It hasn’t hurt.  American papers love the sensational.
26,ANNE: I’m sure they do.,ANNE,I’m sure they do.
27,PASSENGERS: What now?,PASSENGERS,What now?
28,RED CROSS WOMAN 2:  The Germans have ambushed the line.,RED CROSS WOMAN 2, The Germans have ambushed the line.
29,GERMANS: Open the door.,GERMANS,Open the door.
30,     SCENE: Outside the train,     SCENE,Outside the train
31,ANNE: What in the name of God is going on?,ANNE,What in the name of God is going on?
32,"JACK: Quiet down, will you? We’ll be shot because of you.  Here.  Go in the trench.  Hurry.  We have no choice but to hide here until morning.",JACK,"Quiet down, will you? We’ll be shot because of you.  Here.  Go in the trench.  Hurry.  We have no choice but to hide here until morning."
33,ANNE: I have to find a way to get back to the field hospital at Bar-le-duc.,ANNE,I have to find a way to get back to the field hospital at Bar-le-duc.
34,"JACK: Maybe that is the only safe place, as long as it’s been cleared.  Get rid of that uniform.",JACK,"Maybe that is the only safe place, as long as it’s been cleared.  Get rid of that uniform."
35,ANNE: Why?,ANNE,Why?
36,JACK: Jerries will shoot you on site like those poor wretches back there.,JACK,Jerries will shoot you on site like those poor wretches back there.
37,ANNE: Why?  They were with the Red Cross.,ANNE,Why?  They were with the Red Cross.
38,"JACK: Red Cross volunteers equals supplies.  The Jerries are in worse shape than the Limeys right now.  They’ll kill you as soon as they look at you if they think you’ve got morphine.  Colette, Anne Shirley.",JACK,"Red Cross volunteers equals supplies.  The Jerries are in worse shape than the Limeys right now.  They’ll kill you as soon as they look at you if they think you’ve got morphine.  Colette, Anne Shirley."
39,ANNE: Anne Blythe.,ANNE,Anne Blythe.
40,"JACK: Anne, this is Colette. ",JACK,"Anne, this is Colette. "
41,ANNE: Hello.,ANNE,Hello.
42,"JACK: She doesn’t speak English.  Family’s scattered.  I planned on getting them to safety, but plans changed for worse.  [to Colette] Tu dors, maintenant.  Cherie, tu dors.",JACK,"She doesn’t speak English.  Family’s scattered.  I planned on getting them to safety, but plans changed for worse.  [to Colette] Tu dors, maintenant.  Cherie, tu dors."
43,"ANNE: Thank heavens, not everything’s lost. How old is the baby?",ANNE,"Thank heavens, not everything’s lost. How old is the baby?"
44,JACK: Barely a year.,JACK,Barely a year.
45,"ANNE: I never thought I’d live to see the day I’d thank you, Jack Garrison.  Colette, pour le bebe.  Pour vous.  Here, pour vous.  Pour la manger.",ANNE,"I never thought I’d live to see the day I’d thank you, Jack Garrison.  Colette, pour le bebe.  Pour vous.  Here, pour vous.  Pour la manger."
46,"COLETTE: Merci, madam. Merci.",COLETTE,"Merci, madam. Merci."
47,ANNE: Jack?,ANNE,Jack?
48,"JACK: No, thank you.  Anne, I meant what I said, back in New York.  I wanted to help you.",JACK,"No, thank you.  Anne, I meant what I said, back in New York.  I wanted to help you."
49,"ANNE: Your life has obviously gone in one sweeping direction and mine in another.  I meant what I said, too.  [sensing movement above]  Mr. Garrison.  Mr. Garrison.",ANNE,"Your life has obviously gone in one sweeping direction and mine in another.  I meant what I said, too.  [sensing movement above]  Mr. Garrison.  Mr. Garrison."
50,JACK: It’s a German horse to boot.,JACK,It’s a German horse to boot.
51,ANNE: Maybe we can hitch it to a wagon and help us get back to the field hospital.,ANNE,Maybe we can hitch it to a wagon and help us get back to the field hospital.
52,"JACK: Anne.  Anne!  They’re blowing up the train back there.  Come back!  You can’t be seen, Anne!",JACK,"Anne.  Anne!  They’re blowing up the train back there.  Come back!  You can’t be seen, Anne!"
53,ANNE: [explosives go off] No!,ANNE,[explosives go off] No!
54,JACK: Are you hurt?,JACK,Are you hurt?
55,ANNE: No.,ANNE,No.
56,"JACK: That’s the train they’re blowing up.  Hell of a way to come up with story material, huh, Mrs. Blythe?  We’ll hitch the horse to a wagon and move out at dawn, if it’s clear.  Move!",JACK,"That’s the train they’re blowing up.  Hell of a way to come up with story material, huh, Mrs. Blythe?  We’ll hitch the horse to a wagon and move out at dawn, if it’s clear.  Move!"
57,     SCENE: Next day,     SCENE,Next day
58,"LIEUTENANT:  They’ve broken through, Captain.  They gassed us and broke through.",LIEUTENANT," They’ve broken through, Captain.  They gassed us and broke through."
59,"CAPTAIN:  Fix your bloody bayonets, officers!",CAPTAIN," Fix your bloody bayonets, officers!"
60,ANNE: We have to go help.,ANNE,We have to go help.
61,"JACK: No, Anne, wait!  [to Colette] Cover the baby.  Anne, wait!  Those fumes are toxic.  A couple of whiffs of that stuff and you won’t get up.  I can’t move them around here anymore.",JACK,"No, Anne, wait!  [to Colette] Cover the baby.  Anne, wait!  Those fumes are toxic.  A couple of whiffs of that stuff and you won’t get up.  I can’t move them around here anymore."
62,ANNE: What are you saying?,ANNE,What are you saying?
63,JACK: I’ll catch up with you at the field hospital. ,JACK,I’ll catch up with you at the field hospital. 
64,ANNE: What?,ANNE,What?
65,"JACK: If I don’t show up, something happened.",JACK,"If I don’t show up, something happened."
66,"ANNE: Jack, where are you going?",ANNE,"Jack, where are you going?"
67,JACK: I need you to get Colette and the baby to this address in London.,JACK,I need you to get Colette and the baby to this address in London.
68,ANNE: What are you talking about?,ANNE,What are you talking about?
69,JACK: I have an apartment there.  I keep it as an office.  It’s all paid for.,JACK,I have an apartment there.  I keep it as an office.  It’s all paid for.
70,ANNE: I can’t leave France while you run off and get yourself a good story!,ANNE,I can’t leave France while you run off and get yourself a good story!
71,"JACK: I wish it were that simple.  This war has to end and I have my part in it.  The field hospital’s down in the valley.  Ho, Sergeant!  Sergeant, is General Pershing on that train?  I need to talk to him.  Wait!  Damnit!  American soldiers: courage, but nothing upstairs.  Madame Blythe vous protégé tous les deux.  ",JACK,"I wish it were that simple.  This war has to end and I have my part in it.  The field hospital’s down in the valley.  Ho, Sergeant!  Sergeant, is General Pershing on that train?  I need to talk to him.  Wait!  Damnit!  American soldiers: courage, but nothing upstairs.  Madame Blythe vous protégé tous les deux.  "
72,ANNE: No.,ANNE,No.
73,JACK: She’s a good woman. ,JACK,She’s a good woman. 
74,"COLETTE: Jack, amene-moi avec toi.",COLETTE,"Jack, amene-moi avec toi."
75,"JACK: Non, ca suffit, ca suffit.  Au revoir.  Au revoir, big guy.",JACK,"Non, ca suffit, ca suffit.  Au revoir.  Au revoir, big guy."
76,ANNE: Wait!  Wait!  YOU ARE DESPICABLE!  If I ever get my hands on you!,ANNE,Wait!  Wait!  YOU ARE DESPICABLE!  If I ever get my hands on you!
77,     SCENE: Field Hospital,     SCENE,Field Hospital
78,"GILBERT: He’ll live, if we can find a quiet truck for him that doesn’t shake.",GILBERT,"He’ll live, if we can find a quiet truck for him that doesn’t shake."
79,"FEMALE V.A.D.: Picked up a whole company half and hour ago, Doctor.  No one noticed them missing until the gas attack this morning.",FEMALE V.A.D.,"Picked up a whole company half and hour ago, Doctor.  No one noticed them missing until the gas attack this morning."
80,JACK: General Spence has orders that we move to Neufchateau by this afternoon.,JACK,General Spence has orders that we move to Neufchateau by this afternoon.
81,FEMALE V.A.D.: We’ll never get all the casualties in from the field by then.,FEMALE V.A.D.,We’ll never get all the casualties in from the field by then.
82,"GILBERT: Well, then, we’re going bring back the one that we have a hope of treating, not these poor souls that are gone by the time we get them.  If we’re overrun, they’ll capture this hospital for supplies.  Just give them all a good dose of morphine in the truck so they can sleep.  My orders stand.",GILBERT,"Well, then, we’re going bring back the one that we have a hope of treating, not these poor souls that are gone by the time we get them.  If we’re overrun, they’ll capture this hospital for supplies.  Just give them all a good dose of morphine in the truck so they can sleep.  My orders stand."
83,FEMALE V.A.D.: Right.,FEMALE V.A.D.,Right.
84,GILBERT: Dope them up.  I’ll be outside.,GILBERT,Dope them up.  I’ll be outside.
85,"NURSE: Doctor will be on soon, love.",NURSE,"Doctor will be on soon, love."
86,"FEMALE V.A.D.: Come on, let’s get out of here.",FEMALE V.A.D.,"Come on, let’s get out of here."
87,"SOLDIER: Dr. Blythe, Colonel Marshall wants you to head up to the clearing station.  Headquarters has been shelled.  They’re up to their eyeballs in fatalities.  We can take this ambulance. [he leaves; Anne arrives]",SOLDIER,"Dr. Blythe, Colonel Marshall wants you to head up to the clearing station.  Headquarters has been shelled.  They’re up to their eyeballs in fatalities.  We can take this ambulance. [he leaves; Anne arrives]"
88,"ANNE: Here, Let me take him.  No, no, no, it’s all right.  Please, help me.  This woman’s exhausted.  No, it’s all right.  My husband might be here.  He can help us.  I’ll get food.  Excuse me.  Excuse me, I’m looking for Dr. Gilbert Blythe.  He’s my husband.",ANNE,"Here, Let me take him.  No, no, no, it’s all right.  Please, help me.  This woman’s exhausted.  No, it’s all right.  My husband might be here.  He can help us.  I’ll get food.  Excuse me.  Excuse me, I’m looking for Dr. Gilbert Blythe.  He’s my husband."
89,"FEMALE V.A.D.: Up there, love.",FEMALE V.A.D.,"Up there, love."
90,"ANNE: GIL!  Gil! [bombs explode, Colette falls] Are you all right, Colette?  Please, please, take the baby in the tent, please.  Help me!",ANNE,"GIL!  Gil! [bombs explode, Colette falls] Are you all right, Colette?  Please, please, take the baby in the tent, please.  Help me!"
91,"SOLDIER: There’s no time to spare.  We’re being bombed.  Matron, round up all available drivers.",SOLDIER,"There’s no time to spare.  We’re being bombed.  Matron, round up all available drivers."
92,"ANNE: Lay her down there.  Okay.  It’s all right, Colette.  It’s okay.  It’s all right.  It’s going to be all right.",ANNE,"Lay her down there.  Okay.  It’s all right, Colette.  It’s okay.  It’s all right.  It’s going to be all right."
93,"COLETTE: Promettez…  Promettez...  Promettez, moi.  Promettez. Mon bebe…  Promettez…",COLETTE,"Promettez…  Promettez...  Promettez, moi.  Promettez. Mon bebe…  Promettez…"
94,"ANNE: Promise?  Yes, I promise.  ",ANNE,"Promise?  Yes, I promise.  "
95,COLETTE: Garde-le,COLETTE,Garde-le
96,ANNE: I promise.,ANNE,I promise.
97,COLETTE: Garde-le,COLETTE,Garde-le
98,ANNE: I promise.,ANNE,I promise.
99,"FEMALE V.A.D.: We need every able-bodied driver, madam. If you’re Dr. Blythe’s wife, you can meet him at the next station.  ",FEMALE V.A.D.,"We need every able-bodied driver, madam. If you’re Dr. Blythe’s wife, you can meet him at the next station.  "
100,ANNE: She’s gone.  ,ANNE,She’s gone.  
101,"FEMALE V.A.D.: Step this way, dear.",FEMALE V.A.D.,"Step this way, dear."
102,ANNE: What about this baby?,ANNE,What about this baby?
103,FEMALE V.A.D.: Field nurses should look after it.  Follow me.,FEMALE V.A.D.,Field nurses should look after it.  Follow me.
104,ANNE: What about the girl?,ANNE,What about the girl?
105,"FEMALE V.A.D.: Stretcher-bearer’s duty, dear.  Maps and whatever supplies are in the canteen up front. [explosions]  Get moving!  This place is going to be destroyed.",FEMALE V.A.D.,"Stretcher-bearer’s duty, dear.  Maps and whatever supplies are in the canteen up front. [explosions]  Get moving!  This place is going to be destroyed."
106,"NURSE: Right.  Cripes, that was close.  Here, let me take him.  What’s his name?",NURSE,"Right.  Cripes, that was close.  Here, let me take him.  What’s his name?"
107,ANNE: Dominic.,ANNE,Dominic.
108,"NURSE: Thank God you can drive, miss.  When them shell-shocked stretcher-bearers get behind the wheel, Lord.",NURSE,"Thank God you can drive, miss.  When them shell-shocked stretcher-bearers get behind the wheel, Lord."
109,"FEMALE V.A.D.: Avoid mud holes at all costs.  Abigail, do navigate for her.",FEMALE V.A.D.,"Avoid mud holes at all costs.  Abigail, do navigate for her."
110,ANNE: What will happen to him?,ANNE,What will happen to him?
111,"NURSE: Maybe find a home, the church in the next town if it isn’t blasted to smithereens.",NURSE,"Maybe find a home, the church in the next town if it isn’t blasted to smithereens."
112,"     SCENE: Neufchateau, September 1918",     SCENE,"Neufchateau, September 1918"
113,FEMALE V.A.D.: The field hospital’s through there.  Unload these trucks as quickly as possible.,FEMALE V.A.D.,The field hospital’s through there.  Unload these trucks as quickly as possible.
114,"NURSE: Little tyke’s bloody hungry, he is.  Here, looks like he’s yours from now on.",NURSE,"Little tyke’s bloody hungry, he is.  Here, looks like he’s yours from now on."
115,"ANNE: I’ll get you fed.  I’ll try and find some food.  [to priest] Merci, mon pere.",ANNE,"I’ll get you fed.  I’ll try and find some food.  [to priest] Merci, mon pere."
116,PRIEST: Soyez prudente.  C’est un miracle le petit qui a survi.  Et qu’est devenue la maman?,PRIEST,Soyez prudente.  C’est un miracle le petit qui a survi.  Et qu’est devenue la maman?
117,ANNE: Elle est morte.,ANNE,Elle est morte.
118,"PRIEST: Et vous, mon enfant, d’ou venez-vous?",PRIEST,"Et vous, mon enfant, d’ou venez-vous?"
119,"ANNE: Ah, je… Canadienne.  Je suis Canadienne.",ANNE,"Ah, je… Canadienne.  Je suis Canadienne."
120,"PRIEST: Ah, Canadienne.  C’est tres bon.  On a beaucoup de Canadiens ici dans notre village.  Vous cherez une famille pour s’occuper de l’enfant, c’est ça?",PRIEST,"Ah, Canadienne.  C’est tres bon.  On a beaucoup de Canadiens ici dans notre village.  Vous cherez une famille pour s’occuper de l’enfant, c’est ça?"
121,"ANNE: Oui.  Ah… S’il vous plait, watch him.  Garde-le, s’il vous plait, while I help les malades.  [to nurse] Have you seen Dr. Blythe yet?  He’s supposed to have returned from the clearing station.",ANNE,"Oui.  Ah… S’il vous plait, watch him.  Garde-le, s’il vous plait, while I help les malades.  [to nurse] Have you seen Dr. Blythe yet?  He’s supposed to have returned from the clearing station."
122,NURSE: I know they were trying to evacuate the station when we left.  None of them troops have returned yet.,NURSE,I know they were trying to evacuate the station when we left.  None of them troops have returned yet.
123,"ANNE: Oh, I’m so close. I just saw him.",ANNE,"Oh, I’m so close. I just saw him."
124,"NURSE: You’ll meet up again, love.  Calm down.",NURSE,"You’ll meet up again, love.  Calm down."
125,ANNE: I’m sorry.  I’ve been searching for months.  Did any of the American troops come here?,ANNE,I’m sorry.  I’ve been searching for months.  Did any of the American troops come here?
126,"NURSE: Sorry, love.  All of this noise about Yanks joining the war and I haven’t seen one of them set foot on French soil yet.",NURSE,"Sorry, love.  All of this noise about Yanks joining the war and I haven’t seen one of them set foot on French soil yet."
127,ANNE: I see.  Can I help?,ANNE,I see.  Can I help?
128,NURSE: Some of those blokes are in dire pain.  Go slip one of these under their tongues with a little of water. Morphine.,NURSE,Some of those blokes are in dire pain.  Go slip one of these under their tongues with a little of water. Morphine.
129,ANNE: [to a soldier]  Hello.,ANNE,[to a soldier]  Hello.
130,FRED: Anne?  Anne? Anne.,FRED,Anne?  Anne? Anne.
131,"ANNE: Oh, my God.  Fred, it’s…",ANNE,"Oh, my God.  Fred, it’s…"
132,FRED: It is you.,FRED,It is you.
133,"ANNE: Fred,it’s...  Oh, Fred, we thought we’d lost you.",ANNE,"Fred,it’s...  Oh, Fred, we thought we’d lost you."
134,FRED: Not yet.,FRED,Not yet.
135,"ANNE: Oh, gracious Providence.  I would have taken you for dead.",ANNE,"Oh, gracious Providence.  I would have taken you for dead."
136,FRED: Can you find someone to treat this?,FRED,Can you find someone to treat this?
137,"ANNE: Yes, of course, of course.  Fred, here.  Here, Fred.  Put this on your tongue.  You’re all right.  I’ll come back.  Oh, gracious Providence.  Oh, Fred.  Hang on.  [to nurse] Nurse, nurse.  Can you get a someone to help clean and disinfect this soldier’s wounds?",ANNE,"Yes, of course, of course.  Fred, here.  Here, Fred.  Put this on your tongue.  You’re all right.  I’ll come back.  Oh, gracious Providence.  Oh, Fred.  Hang on.  [to nurse] Nurse, nurse.  Can you get a someone to help clean and disinfect this soldier’s wounds?"
138,"NURSE: Sorry, dear.  As soon as the doctor’s free.",NURSE,"Sorry, dear.  As soon as the doctor’s free."
139,ANNE: All right.  Fred.,ANNE,All right.  Fred.
140,"FRED: Oh, how are my little ones, Anne?  How’s Diana?",FRED,"Oh, how are my little ones, Anne?  How’s Diana?"
141,"ANNE: Everyone was fine, I think.  I’ve written to Diana, but I’ve been traveling around so much that she doesn’t know how to...  Fred, I’m prattling on.",ANNE,"Everyone was fine, I think.  I’ve written to Diana, but I’ve been traveling around so much that she doesn’t know how to...  Fred, I’m prattling on."
142,FRED: They say I can’t fight anymore.  Can you get me home?  ,FRED,They say I can’t fight anymore.  Can you get me home?  
143,ANNE: Gil can help.,ANNE,Gil can help.
144,FRED: Gil?,FRED,Gil?
145,"ANNE: I saw him at the field hospital. He’s coming from the clearing station.  All right, Fred?  Right.  [to Red Cross woman]  Is anyone going back to Bar-le-duc?",ANNE,"I saw him at the field hospital. He’s coming from the clearing station.  All right, Fred?  Right.  [to Red Cross woman]  Is anyone going back to Bar-le-duc?"
146,FEMALE V.A.D.: There’s nothing left. The Germans completely razed the field hospital.,FEMALE V.A.D.,There’s nothing left. The Germans completely razed the field hospital.
147,ANNE: Did you see my husband leave?,ANNE,Did you see my husband leave?
148,FEMALE V.A.D.: I don’t know.,FEMALE V.A.D.,I don’t know.
149,"ANNE: Didn’t he leave the clearing station?  Please, tell me what happened.  [a bomb explodes]",ANNE,"Didn’t he leave the clearing station?  Please, tell me what happened.  [a bomb explodes]"
150,FEMALE V.A.D.: Get down!,FEMALE V.A.D.,Get down!
151,"ANNE: Fred!  Fred!  Oh, my God.  Oh, no, no.  Dominic!  Mon pere! Father! [seeing him dead] Father.  Dominic.  DOMINIC! [she finds him]  Here we go.  Here we go.  [seeing Fred] Help me please, I’m going to have to get this man loaded on.  I’ll help.  I’ll help you.  This way.  Where is this convoy departing for?",ANNE,"Fred!  Fred!  Oh, my God.  Oh, no, no.  Dominic!  Mon pere! Father! [seeing him dead] Father.  Dominic.  DOMINIC! [she finds him]  Here we go.  Here we go.  [seeing Fred] Help me please, I’m going to have to get this man loaded on.  I’ll help.  I’ll help you.  This way.  Where is this convoy departing for?"
152,"SOLDIER:  All the way to Boulogne, I think.  I have to get a few of these casualties back to England.",SOLDIER," All the way to Boulogne, I think.  I have to get a few of these casualties back to England."
153,"FEMALE V.A.D.: This whole town has to keep moving.  Ah, Mrs. Blythe, we need you over here. Get that ambulance over here!  Step this way.  Hurry now.",FEMALE V.A.D.,"This whole town has to keep moving.  Ah, Mrs. Blythe, we need you over here. Get that ambulance over here!  Step this way.  Hurry now."
154,"ANNE: Please, my husband didn’t get out, did he?",ANNE,"Please, my husband didn’t get out, did he?"
155,"FEMALE V.A.D.: I can’t say.  Get in, please.  We’ve no time to even think.",FEMALE V.A.D.,"I can’t say.  Get in, please.  We’ve no time to even think."
156,"ANNE: No, wait.  Wait, please.  The baby.",ANNE,"No, wait.  Wait, please.  The baby."
157,"FEMALE V.A.D.: Give it up to one of the townswomen, please!",FEMALE V.A.D.,"Give it up to one of the townswomen, please!"
158,"V.A.D. DRIVER: Oh, it’s like a state of siege, isn’t it?  You can’t take a mum away from her baby.  Will you get out of the bloody way; we’re trapped!",V.A.D. DRIVER,"Oh, it’s like a state of siege, isn’t it?  You can’t take a mum away from her baby.  Will you get out of the bloody way; we’re trapped!"
159,ANNE: Any of these vehicles from Bar-le-duc?,ANNE,Any of these vehicles from Bar-le-duc?
160,"V.A.D. DRIVER: No, this it is.  Everyone else left in the field is either captured or killed.",V.A.D. DRIVER,"No, this it is.  Everyone else left in the field is either captured or killed."
161,ANNE: I have to go to the convoy that’s departing for Boulogne.  I have a friend in the truck and I have to see that he gets out.,ANNE,I have to go to the convoy that’s departing for Boulogne.  I have a friend in the truck and I have to see that he gets out.
162,"V.A.D. DRIVER: Well, you just relax.  It can’t get any worse for him.",V.A.D. DRIVER,"Well, you just relax.  It can’t get any worse for him."
163,     SCENE: Nighttime ,     SCENE,Nighttime 
164,ANNE: [trying to soothe Dominic] It’s okay.,ANNE,[trying to soothe Dominic] It’s okay.
165,FEMALE V.A.D.: Load the men back on.  We can’t afford to spend the night in this area.  Come on.  I need someone over here.,FEMALE V.A.D.,Load the men back on.  We can’t afford to spend the night in this area.  Come on.  I need someone over here.
166,     SCENE: Boulogne,     SCENE,Boulogne
167,ANNE: He needs to be fed.  Can we get some milk?,ANNE,He needs to be fed.  Can we get some milk?
168,NURSE: You help unload.  I’ll take him to the infirmary.,NURSE,You help unload.  I’ll take him to the infirmary.
169,ANNE: Where’s Officer Blythe?  He was in your truck.,ANNE,Where’s Officer Blythe?  He was in your truck.
170,"FEMALE V.A.D.: If you want to find somebody, lady, get back on the next convoy to the front, but stop wandering around when these men are clamoring for help!",FEMALE V.A.D.,"If you want to find somebody, lady, get back on the next convoy to the front, but stop wandering around when these men are clamoring for help!"
171,     SCENE: In tent,     SCENE,In tent
172,"SOLDIER: [in pain] No, no, no, no.",SOLDIER,"[in pain] No, no, no, no."
173,"NURSE : It’s all right.  It’s all right.  Settle down now. Let me help you.  Soldier, listen to me.  Look at me. You’ve got to listen to me….",NURSE ,"It’s all right.  It’s all right.  Settle down now. Let me help you.  Soldier, listen to me.  Look at me. You’ve got to listen to me…."
174,"ANNE: Nurse, Officer Blythe?",ANNE,"Nurse, Officer Blythe?"
175,"NURSE TILDA: He’s over there, ma’am.",NURSE TILDA,"He’s over there, ma’am."
176,"ANNE: Doctor, I know this man.  How can I help him?",ANNE,"Doctor, I know this man.  How can I help him?"
177,"DOCTOR:  Well, I had to amputate the arm to remove the gangrene.  I’ve done all that I can do. See that he’s lucky enough to get shipped out.",DOCTOR," Well, I had to amputate the arm to remove the gangrene.  I’ve done all that I can do. See that he’s lucky enough to get shipped out."
178,ANNE: Fred? Fred?,ANNE,Fred? Fred?
179,FRED: What’s going to happen to me?,FRED,What’s going to happen to me?
180,ANNE: We’re going to get you home.  Fred.  We’re going to get you home.  I saw their faces when you went missing.  We’re going to get you home to your children.  [to nurse]  Can I get him on the next ship out of port?,ANNE,We’re going to get you home.  Fred.  We’re going to get you home.  I saw their faces when you went missing.  We’re going to get you home to your children.  [to nurse]  Can I get him on the next ship out of port?
181,NURSE TILDA: All right.  Cover him up and don’t let anyone hear him cry.,NURSE TILDA,All right.  Cover him up and don’t let anyone hear him cry.
182,"DOCTOR: We’re leaving for Paris, Tilda.  The station at the embassy needs massive help.",DOCTOR,"We’re leaving for Paris, Tilda.  The station at the embassy needs massive help."
183,ANNE: Excuse me.  Can I trouble you further?,ANNE,Excuse me.  Can I trouble you further?
184,NURSE TILDA: Yes.,NURSE TILDA,Yes.
185,"ANNE: Can you take this note to the embassy, in chance that my husband’s whereabouts become known to the Red Cross?",ANNE,"Can you take this note to the embassy, in chance that my husband’s whereabouts become known to the Red Cross?"
